{
  "$schema": "../meta/catalog.schema.json",
  "id": "cat20",
  "sunatCatalog": "20",
  "name": "Motivo de Traslado",
  "source": "Catálogo 20 as published in the 'Catálogos' sheet of perunio-facturador/resources/reglas/reglas-validacion-gre-2026-09-25.xlsx — the GRE 2.0 rules, which check cac:Shipment/cbc:HandlingCode against it (ERROR 3405): fourteen motivos, all here. The CPE workbook (perunio-facturador/resources/reglas/reglas-validacion-cpe-2026-08-26.xlsx) still carries an older thirteen-código list without 19: SUNAT deleted the old 19 in 2022 and the GRE rules re-added it on 2024-11-14 as 'Traslado de mercancía extranjera' (GRE Control de Cambios), which is what 19 means here — it read 'Traslado a zona primaria' until v1.2.0. Only the nine motivos perunio-facturador's validator accepts carry `emit` (internal/validation/despatch.go, Cat20Emit). 03, 05, 06, 07 and 17 are valid SUNAT motivos but stay display-only until the pipeline supports them: 03 needs a comprador (OBSERV 4378) and 07 a proveedor (OBSERV 4375), which the despatch model does not carry, and 06 and 17 need a destinatario with RUC (ERROR 3417). That validator reports a motivo outside the set as 2800, which in SUNAT's table is the receptor's tipo de documento; SUNAT's own code for a motivo outside Cat.20 is 3405. flags.requiereNumeroDAM marks 08 and 09, whose guía must relate a DAM or a DS (Cat.61 50 or 52; ERROR 3440). It does not describe 19, which accepts a DAM, DS, manifiesto de carga or cita de entrega (50, 52, 91 or 92; ERROR 3493) and also needs a puerto or aeropuerto (ERROR 3483).",
  "codePattern": "^[0-9]{2}$",
  "entries": [
    {
      "code": "01",
      "label": "Venta",
      "description": "Venta",
      "capabilities": [
        "emit",
        "select"
      ],
      "flags": {
        "requiereNumeroDAM": false
      },
      "props": {},
      "goName": "Venta"
    },
    {
      "code": "02",
      "label": "Compra",
      "description": "Compra",
      "capabilities": [
        "emit",
        "select"
      ],
      "flags": {
        "requiereNumeroDAM": false
      },
      "props": {},
      "goName": "Compra"
    },
    {
      "code": "03",
      "label": "Venta con entrega a terceros",
      "description": "Venta con entrega a terceros",
      "capabilities": [],
      "flags": {
        "requiereNumeroDAM": false
      },
      "props": {},
      "goName": "VentaEntregaTerceros"
    },
    {
      "code": "04",
      "label": "Traslado entre establecimientos de la misma empresa",
      "description": "Traslado entre establecimientos de la misma empresa",
      "capabilities": [
        "emit",
        "select"
      ],
      "flags": {
        "requiereNumeroDAM": false
      },
      "props": {},
      "goName": "TrasladoEntreEstablecimientos"
    },
    {
      "code": "05",
      "label": "Consignación",
      "description": "Consignación",
      "capabilities": [],
      "flags": {
        "requiereNumeroDAM": false
      },
      "props": {},
      "goName": "Consignacion"
    },
    {
      "code": "06",
      "label": "Devolución",
      "description": "Devolución",
      "capabilities": [],
      "flags": {
        "requiereNumeroDAM": false
      },
      "props": {},
      "goName": "Devolucion"
    },
    {
      "code": "07",
      "label": "Recojo de bienes transformados",
      "description": "Recojo de bienes transformados",
      "capabilities": [],
      "flags": {
        "requiereNumeroDAM": false
      },
      "props": {},
      "goName": "RecojoBienesTransformados"
    },
    {
      "code": "08",
      "label": "Importación",
      "description": "Importación",
      "capabilities": [
        "emit",
        "select"
      ],
      "flags": {
        "requiereNumeroDAM": true
      },
      "props": {},
      "goName": "Importacion"
    },
    {
      "code": "09",
      "label": "Exportación",
      "description": "Exportación",
      "capabilities": [
        "emit",
        "select"
      ],
      "flags": {
        "requiereNumeroDAM": true
      },
      "props": {},
      "goName": "Exportacion"
    },
    {
      "code": "13",
      "label": "Otros",
      "description": "Otros",
      "capabilities": [
        "emit",
        "select"
      ],
      "flags": {
        "requiereNumeroDAM": false
      },
      "props": {},
      "goName": "Otros"
    },
    {
      "code": "14",
      "label": "Venta sujeta a confirmación del comprador",
      "description": "Venta sujeta a confirmación del comprador",
      "capabilities": [
        "emit",
        "select"
      ],
      "flags": {
        "requiereNumeroDAM": false
      },
      "props": {},
      "goName": "VentaSujetaConfirmacion"
    },
    {
      "code": "17",
      "label": "Traslado de bienes para transformación",
      "description": "Traslado de bienes para transformación",
      "capabilities": [],
      "flags": {
        "requiereNumeroDAM": false
      },
      "props": {},
      "goName": "TrasladoParaTransformacion"
    },
    {
      "code": "18",
      "label": "Traslado emisor itinerante CP",
      "description": "Traslado emisor itinerante CP",
      "capabilities": [
        "emit",
        "select"
      ],
      "flags": {
        "requiereNumeroDAM": false
      },
      "props": {},
      "goName": "EmisorItinerante"
    },
    {
      "code": "19",
      "label": "Traslado de mercancía extranjera",
      "description": "Traslado de mercancía extranjera",
      "capabilities": [
        "emit",
        "select"
      ],
      "flags": {
        "requiereNumeroDAM": false
      },
      "props": {},
      "goName": "ZonaPrimaria"
    }
  ]
}
