{
  "$schema": "../meta/catalog.schema.json",
  "id": "cat55",
  "sunatCatalog": "55",
  "name": "Código de identificación del concepto tributario (propiedades del ítem)",
  "source": "Anexo 8 (catálogo 55) from the 'Catálogos' sheet of perunio-facturador/resources/reglas/reglas-validacion-cpe-2026-08-26.xlsx: the cbc:NameCode of a line's cac:AdditionalItemProperty. Only the six Detracciones: Recursos Hidrobiológicos concepts are here (3001-3006, none struck through): a factura or boleta under tipo de operación 1002 (Cat.54 004) must declare all six on its lines (ERRORs 3063, 3130-3135). The other ~100 concepts (transporte terrestre, hospedajes, vehículos, gas natural…) are added when a Perunio feature emits them. The label drops the workbook's 'Detracciones: Recursos Hidrobiológicos-' prefix, which description keeps. None is `emit` yet: perunio-facturador still refuses 004 (perunio-facturador FOLLOWUPS.md FU-7).",
  "codePattern": "^[0-9]{4}$",
  "entries": [
    {
      "code": "3001",
      "label": "Matrícula de la embarcación",
      "description": "Detracciones: Recursos Hidrobiológicos-Matrícula de la embarcación",
      "capabilities": [],
      "flags": {},
      "props": {},
      "goName": "MatriculaEmbarcacion"
    },
    {
      "code": "3002",
      "label": "Nombre de la embarcación",
      "description": "Detracciones: Recursos Hidrobiológicos-Nombre de la embarcación",
      "capabilities": [],
      "flags": {},
      "props": {},
      "goName": "NombreEmbarcacion"
    },
    {
      "code": "3003",
      "label": "Tipo de especie vendida",
      "description": "Detracciones: Recursos Hidrobiológicos-Tipo de especie vendida",
      "capabilities": [],
      "flags": {},
      "props": {},
      "goName": "TipoEspecie"
    },
    {
      "code": "3004",
      "label": "Lugar de descarga",
      "description": "Detracciones: Recursos Hidrobiológicos-Lugar de descarga",
      "capabilities": [],
      "flags": {},
      "props": {},
      "goName": "LugarDescarga"
    },
    {
      "code": "3005",
      "label": "Fecha de descarga",
      "description": "Detracciones: Recursos Hidrobiológicos-Fecha de descarga",
      "capabilities": [],
      "flags": {},
      "props": {},
      "goName": "FechaDescarga"
    },
    {
      "code": "3006",
      "label": "Cantidad de especie vendida",
      "description": "Detracciones: Recursos Hidrobiológicos-Cantidad de especie vendida",
      "capabilities": [],
      "flags": {},
      "props": {},
      "goName": "CantidadEspecie"
    }
  ]
}
