{
  "$schema": "../meta/catalog.schema.json",
  "id": "cat06",
  "sunatCatalog": "06",
  "name": "Tipo de Documento de Identidad",
  "source": "Anexo 8 RS 097-2012/SUNAT (v2.1), catálogo 06, transcribed from the 'Catálogos' sheet of resources/AjustesValidacionesCPEv20260212.xlsx. That sheet lists thirteen códigos. Every existing copy was short: perunio-facturador/internal/model/catalog.go named ten (stopping at E) and the frontend and backend offered six. Go also mislabelled E as NITE — the sheet gives it as TAM, Tarjeta Andina de Migración. props.numberPattern is set only where a length rule is actually documented and enforced today (RUC and DNI); null means the número is not constrained, not that it is unvalidated by SUNAT. The `select` subset is exactly what the issuance UI offers today — widening it is a data-only change once each código gains a numberPattern.",
  "codePattern": "^[0-9A-H]$",
  "entries": [
    {
      "code": "0",
      "label": "Sin documento",
      "description": "DOC.TRIB.NO.DOM.SIN.RUC",
      "capabilities": [
        "emit",
        "select"
      ],
      "flags": {
        "identifica": false
      },
      "props": {
        "numberPattern": null
      },
      "goName": "DocTribNoDomSinRUC"
    },
    {
      "code": "1",
      "label": "DNI",
      "description": "Documento Nacional de Identidad",
      "capabilities": [
        "emit",
        "select"
      ],
      "flags": {
        "identifica": true
      },
      "props": {
        "numberPattern": "^\\d{8}$"
      },
      "goName": "DNI"
    },
    {
      "code": "4",
      "label": "Carnet de extranjería",
      "description": "Carnet de extranjería",
      "capabilities": [
        "emit",
        "select"
      ],
      "flags": {
        "identifica": true
      },
      "props": {
        "numberPattern": null
      },
      "goName": "CarnetExtranjeria"
    },
    {
      "code": "6",
      "label": "RUC",
      "description": "Registro Unico de Contribuyentes",
      "capabilities": [
        "emit",
        "select"
      ],
      "flags": {
        "identifica": true
      },
      "props": {
        "numberPattern": "^\\d{11}$"
      },
      "goName": "RUC"
    },
    {
      "code": "7",
      "label": "Pasaporte",
      "description": "Pasaporte",
      "capabilities": [
        "emit",
        "select"
      ],
      "flags": {
        "identifica": true
      },
      "props": {
        "numberPattern": null
      },
      "goName": "Pasaporte"
    },
    {
      "code": "A",
      "label": "Cédula diplomática",
      "description": "Cédula Diplomática de identidad",
      "capabilities": [
        "emit",
        "select"
      ],
      "flags": {
        "identifica": true
      },
      "props": {
        "numberPattern": null
      },
      "goName": "CedulaDiplomatica"
    },
    {
      "code": "B",
      "label": "Doc. país de residencia",
      "description": "DOC.IDENT.PAIS.RESIDENCIA-NO.D",
      "capabilities": [
        "emit"
      ],
      "flags": {
        "identifica": true
      },
      "props": {
        "numberPattern": null
      },
      "goName": "DocPaisResidencia"
    },
    {
      "code": "C",
      "label": "TIN",
      "description": "Tax Identification Number - TIN - Doc Trib PP.NN",
      "capabilities": [
        "emit"
      ],
      "flags": {
        "identifica": true
      },
      "props": {
        "numberPattern": null
      },
      "goName": "TIN"
    },
    {
      "code": "D",
      "label": "IN",
      "description": "Identification Number - IN - Doc Trib PP. JJ",
      "capabilities": [
        "emit"
      ],
      "flags": {
        "identifica": true
      },
      "props": {
        "numberPattern": null
      },
      "goName": "IN"
    },
    {
      "code": "E",
      "label": "TAM",
      "description": "TAM - Tarjeta Andina de Migración",
      "capabilities": [
        "emit"
      ],
      "flags": {
        "identifica": true
      },
      "props": {
        "numberPattern": null
      },
      "goName": "TAM"
    },
    {
      "code": "F",
      "label": "PTP",
      "description": "Permiso Temporal de Permanencia - PTP",
      "capabilities": [
        "emit"
      ],
      "flags": {
        "identifica": true
      },
      "props": {
        "numberPattern": null
      },
      "goName": "PTP"
    },
    {
      "code": "G",
      "label": "Salvoconducto",
      "description": "Salvoconducto",
      "capabilities": [
        "emit"
      ],
      "flags": {
        "identifica": true
      },
      "props": {
        "numberPattern": null
      },
      "goName": "Salvoconducto"
    },
    {
      "code": "H",
      "label": "CPP",
      "description": "Carné Permiso Temp.Perman. - CPP",
      "capabilities": [
        "emit"
      ],
      "flags": {
        "identifica": true
      },
      "props": {
        "numberPattern": null
      },
      "goName": "CPP"
    }
  ]
}
