{
  "$schema": "../meta/catalog.schema.json",
  "id": "cat10",
  "sunatCatalog": "10",
  "name": "Tipo de Nota de Débito Electrónica",
  "source": "Anexo 8 (catálogo 10) from the 'Catálogos' sheet of perunio-facturador/resources/reglas/reglas-validacion-cpe-2026-08-26.xlsx: six códigos, all here. 13 (Penalidades) is new and valid only from 2027-01-01, when 03 becomes 'Otros conceptos' — the workbook strikes 'Penalidades/' out of it; both changes were postponed from 2026-08-01 (Control de Cambios of 24.04.2026 and 24.07.2026). From that date an ND 13 needs no cac:BillingReference (ERROR 2524 still applies to every other motivo) and carries no IGV (ERROR 3507). 03 keeps the goName Penalidades it already had, so 13 is SoloPenalidades rather than a reused name whose value would silently change. SUNAT defines six motivos but this pipeline emits two: perunio-facturador's validator accepts only 01 and 02 (Cat10Emit), and the issuance form offers only those. Giving 03, 11, 12 or 13 `emit` would widen what the validator accepts, so they are display-only until the pipeline actually supports them — the point of `emit` is that it describes this service, not SUNAT.",
  "codePattern": "^[0-9]{2}$",
  "entries": [
    {
      "code": "01",
      "label": "Intereses por mora",
      "description": "Intereses por mora",
      "capabilities": [
        "emit",
        "select",
        "on-factura",
        "on-boleta"
      ],
      "flags": {},
      "props": {},
      "goName": "InteresesMora"
    },
    {
      "code": "02",
      "label": "Aumento en el valor",
      "description": "Aumento en el valor",
      "capabilities": [
        "emit",
        "select",
        "on-factura",
        "on-boleta"
      ],
      "flags": {},
      "props": {},
      "goName": "AumentoValor"
    },
    {
      "code": "03",
      "label": "Penalidades u otros conceptos",
      "description": "Penalidades/ otros conceptos",
      "capabilities": [],
      "flags": {},
      "props": {},
      "goName": "Penalidades"
    },
    {
      "code": "11",
      "label": "Ajustes de operaciones de exportación",
      "description": "Ajustes de operaciones de exportación",
      "capabilities": [],
      "flags": {},
      "props": {},
      "goName": "AjustesExportacion"
    },
    {
      "code": "12",
      "label": "Ajustes afectos al IVAP",
      "description": "Ajustes afectos al IVAP",
      "capabilities": [],
      "flags": {},
      "props": {},
      "goName": "AjustesIVAP"
    },
    {
      "code": "13",
      "label": "Penalidades",
      "description": "Penalidades",
      "capabilities": [],
      "flags": {},
      "props": {},
      "goName": "SoloPenalidades"
    }
  ]
}
